{
  "$schema": "https://json-schema.org/draft/2020-12/schema",
  "$id": "artifact-manifest.schema.json",
  "title": "ASI-T Genesis Artifact Manifest",
  "description": "Schema for QS evidence blobs and UTCS anchoring",
  "type": "object",
  "required": [
    "artifact_id",
    "timestamp",
    "validation_version",
    "status",
    "evidence_hash",
    "provenance"
  ],
  "properties": {
    "artifact_id": {
      "type": "string",
      "pattern": "^[A-Z]{2}-[A-Z]{2}-[A-Z0-9]+-[0-9]{4}-[0-9]{2}-[0-9]{2}-[0-9]{2}-[0-9]{3}-(OV|IV|PV|ER|EV|HV|IN|ML|TE|DR|DB|SW|FW)(-[A-Z])?$",
      "description": "UTCS-MI identifier"
    },
    "timestamp": {
      "type": "string",
      "format": "date-time",
      "description": "ISO 8601 timestamp"
    },
    "validation_version": {
      "type": "string",
      "pattern": "^[0-9]+\\.[0-9]+\\.[0-9]+$",
      "description": "Semantic version of validation schema"
    },
    "status": {
      "type": "string",
      "enum": ["PASS", "FAIL", "DECLARED", "NOT_APPLICABLE"],
      "description": "Validation status"
    },
    "evidence_hash": {
      "type": "string",
      "pattern": "^sha256:[a-fA-F0-9]{64}$",
      "description": "SHA-256 hash of evidence data"
    },
    "provenance": {
      "type": "object",
      "required": [
        "policy_hash",
        "model_sha",
        "data_manifest_hash",
        "operator_id",
        "canonical_hash"
      ],
      "properties": {
        "policy_hash": {
          "type": "string",
          "pattern": "^sha256:[a-fA-F0-9]{64}$"
        },
        "model_sha": {
          "type": "string",
          "pattern": "^sha256:[a-fA-F0-9]{64}$"
        },
        "data_manifest_hash": {
          "type": "string",
          "pattern": "^sha256:[a-fA-F0-9]{64}$"
        },
        "operator_id": {
          "type": "string",
          "pattern": "^UTCS:OP:[a-zA-Z0-9-]+$"
        },
        "canonical_hash": {
          "type": "string",
          "pattern": "^sha256:[a-fA-F0-9]{64}$"
        }
      },
      "additionalProperties": false
    },
    "errors": {
      "type": "array",
      "items": {"type": "string"},
      "description": "List of validation errors"
    },
    "warnings": {
      "type": "array",
      "items": {"type": "string"},
      "description": "List of validation warnings"
    },
    "metadata": {
      "type": "object",
      "description": "Additional metadata for the artifact"
    }
  },
  "additionalProperties": false
}